Setting up logger for name='MLGym'
Setting up logger for name='env_utils'
============================================================
Experiment 2: Tree Search WITHOUT Verbalized Sampling
============================================================
Model: Qwen/Qwen3-4B-Instruct-2507
Branching: 3, Depth: 2
Max actions/node: 15
Temperature: 0.9
Verbalized sampling: False

Creating MLGym container...
Setting up logger for name='MLGymEnv'
INFO     Found image aigym/mlgym-agent:latest with tags:                        
         ['aigym/mlgym-agent:latest'], created: 2024-11-04T13:33:17.818245514Z  
         for linux amd64.                                                       
DEBUG    Starting container with command: docker run -i --rm --network host     
         --gpus '"device=7"' --name aigym-mlgym-agent-latest-d_7-0681057b48     
         aigym/mlgym-agent:latest /bin/bash -l                                  
Setting up logger for name='MLGymTask'
DEBUG    Copying data/titanic/data to container at /home/agent/workspace/data   
         with command: docker cp data/titanic/data                              
         f45b330feadb59bebdf438c63aa1ea38e7268286922f02a33d87c7d329f12ee4:/home/
         agent/workspace/data                                                   
DEBUG    Setting agent as owner of copied files at /home/agent/workspace/data   
         with command: docker exec -u root                                      
         f45b330feadb59bebdf438c63aa1ea38e7268286922f02a33d87c7d329f12ee4 chown 
         -R agent:mlgym /home/agent/workspace/data                              
DEBUG    Copying data/titanic/evaluate.py to container at /home/agent/workspace/
         with command: docker cp data/titanic/evaluate.py                       
         f45b330feadb59bebdf438c63aa1ea38e7268286922f02a33d87c7d329f12ee4:/home/
         agent/workspace/                                                       
DEBUG    Setting agent as owner of copied files at /home/agent/workspace/ with  
         command: docker exec -u root                                           
         f45b330feadb59bebdf438c63aa1ea38e7268286922f02a33d87c7d329f12ee4 chown 
         -R agent:mlgym /home/agent/workspace/                                  
DEBUG    Copying /tmp/tmpil4_buqp to container at                               
         /home/agent/commands/defaults.sh with command: docker cp               
         /tmp/tmpil4_buqp                                                       
         f45b330feadb59bebdf438c63aa1ea38e7268286922f02a33d87c7d329f12ee4:/home/
         agent/commands/defaults.sh                                             
DEBUG    Setting agent as owner of copied files at                              
         /home/agent/commands/defaults.sh with command: docker exec -u root     
         f45b330feadb59bebdf438c63aa1ea38e7268286922f02a33d87c7d329f12ee4 chown 
         -R agent:mlgym /home/agent/commands/defaults.sh                        
DEBUG    Copying /tmp/tmp74t89fid to container at /home/agent/commands/search.sh
         with command: docker cp /tmp/tmp74t89fid                               
         f45b330feadb59bebdf438c63aa1ea38e7268286922f02a33d87c7d329f12ee4:/home/
         agent/commands/search.sh                                               
DEBUG    Setting agent as owner of copied files at                              
         /home/agent/commands/search.sh with command: docker exec -u root       
         f45b330feadb59bebdf438c63aa1ea38e7268286922f02a33d87c7d329f12ee4 chown 
         -R agent:mlgym /home/agent/commands/search.sh                          
DEBUG    Copying /tmp/tmpa0kqsawy to container at                               
         /home/agent/commands/edit_linting.sh with command: docker cp           
         /tmp/tmpa0kqsawy                                                       
         f45b330feadb59bebdf438c63aa1ea38e7268286922f02a33d87c7d329f12ee4:/home/
         agent/commands/edit_linting.sh                                         
DEBUG    Setting agent as owner of copied files at                              
         /home/agent/commands/edit_linting.sh with command: docker exec -u root 
         f45b330feadb59bebdf438c63aa1ea38e7268286922f02a33d87c7d329f12ee4 chown 
         -R agent:mlgym /home/agent/commands/edit_linting.sh                    
DEBUG    Copying /tmp/tmp492l_q78 to container at                               
         /home/agent/commands/validate.sh with command: docker cp               
         /tmp/tmp492l_q78                                                       
         f45b330feadb59bebdf438c63aa1ea38e7268286922f02a33d87c7d329f12ee4:/home/
         agent/commands/validate.sh                                             
DEBUG    Setting agent as owner of copied files at                              
         /home/agent/commands/validate.sh with command: docker exec -u root     
         f45b330feadb59bebdf438c63aa1ea38e7268286922f02a33d87c7d329f12ee4 chown 
         -R agent:mlgym /home/agent/commands/validate.sh                        
DEBUG    Copying /tmp/tmpcec2v43t to container at /home/agent/commands/submit.sh
         with command: docker cp /tmp/tmpcec2v43t                               
         f45b330feadb59bebdf438c63aa1ea38e7268286922f02a33d87c7d329f12ee4:/home/
         agent/commands/submit.sh                                               
DEBUG    Setting agent as owner of copied files at                              
         /home/agent/commands/submit.sh with command: docker exec -u root       
         f45b330feadb59bebdf438c63aa1ea38e7268286922f02a33d87c7d329f12ee4 chown 
         -R agent:mlgym /home/agent/commands/submit.sh                          
Container created. Baseline: 0.7655

============================================================
TREE SEARCH - Root Node
============================================================
    [root] step 0: cat << 'ENDOFFILE' > train_and_predict.py
import pandas as pd
import numpy as np
    [root] step 1: validate
    [root] validate score=[]
    [root] step 2: python train_and_predict.py
    [root] python ERROR: /mlgym_generic/lib/python3.11/site-packages/pandas/core/indexes/base.py", line 7070, in drop
    raise KeyError(f"{labels[mask].tolist()} not found in
    [root] step 3: cat << 'ENDOFFILE' > train_and_predict.py
import pandas as pd
import numpy as np
    [root] step 4: validate
    [root] validate score=[]
    [root] step 5: python train_and_predict.py
    [root] step 6: validate
    [root] validate score=[{'accuracy': 0.8492822966507177}]
  [root] validate → 0.8493

============================================================
TREE SEARCH - Depth 1 (1 nodes to expand)
============================================================

  Branching root (score=0.8493) without verbalized sampling...

  --- Branch root_0 (p=0.00) ---
  Strategy: Temperature sample 0
    [root_0] step 0: cat << 'ENDOFFILE' > train_and_predict.py
import pandas as pd
import numpy as np
    [root_0] step 1: validate
    [root_0] validate score=[]
    [root_0] step 2: python train_and_predict.py
    [root_0] step 3: validate
    [root_0] validate score=[{'accuracy': 0.8205741626794258}]
  [root_0] validate → 0.8206

  --- Branch root_1 (p=0.00) ---
  Strategy: Temperature sample 1
    [root_1] step 0: cat << 'ENDOFFILE' > train_and_predict.py
import pandas as pd
import numpy as np
    [root_1] step 1: validate
    [root_1] validate score=[]
    [root_1] step 2: python train_and_predict.py
    [root_1] python ERROR: /mlgym_generic/lib/python3.11/site-packages/pandas/core/indexes/base.py", line 7070, in drop
    raise KeyError(f"{labels[mask].tolist()} not found in
    [root_1] step 3: cat << 'ENDOFFILE' > train_and_predict.py
import pandas as pd
import numpy as np
    [root_1] step 4: validate
    [root_1] validate score=[]
    [root_1] step 5: python train_and_predict.py
    [root_1] python ERROR: /mlgym_generic/lib/python3.11/site-packages/pandas/core/indexes/base.py", line 7070, in drop
    raise KeyError(f"{labels[mask].tolist()} not found in
    [root_1] step 6: cat << 'ENDOFFILE' > train_and_predict.py
import pandas as pd
import numpy as np
    [root_1] step 7: validate
    [root_1] validate score=[]
    [root_1] step 8: python train_and_predict.py
    [root_1] step 9: validate
    [root_1] validate score=[{'accuracy': 0.7607655502392344}]
  [root_1] validate → 0.7608

  --- Branch root_2 (p=0.00) ---
  Strategy: Temperature sample 2
    [root_2] step 0: cat << 'ENDOFFILE' > train_and_predict.py
import pandas as pd
import numpy as np
    [root_2] step 1: python train_and_predict.py
    [root_2] python ERROR: /mlgym_generic/lib/python3.11/site-packages/pandas/core/indexes/base.py", line 7070, in drop
    raise KeyError(f"{labels[mask].tolist()} not found in
    [root_2] step 2: cat << 'ENDOFFILE' > train_and_predict.py
import pandas as pd
import numpy as np
    [root_2] step 3: python train_and_predict.py
    [root_2] step 4: validate
    [root_2] validate score=[{'accuracy': 0.7918660287081339}]
  [root_2] validate → 0.7919

============================================================
TREE SEARCH - Depth 2 (3 nodes to expand)
============================================================

  Branching root_0 (score=0.8206) without verbalized sampling...

  --- Branch root_0_0 (p=0.00) ---
  Strategy: Temperature sample 0
    [root_0_0] step 0: cat << 'ENDOFFILE' > train_and_predict.py
import pandas as pd
import numpy as np
    [root_0_0] step 1: python train_and_predict.py
    [root_0_0] step 2: validate
    [root_0_0] validate score=[{'accuracy': 0.8277511961722488}]
  [root_0_0] validate → 0.8278

  --- Branch root_0_1 (p=0.00) ---
  Strategy: Temperature sample 1
    [root_0_1] step 0: cat << 'ENDOFFILE' > train_and_predict.py
import pandas as pd
import numpy as np
    [root_0_1] step 1: validate
    [root_0_1] validate score=[]
    [root_0_1] step 2: python train_and_predict.py
    [root_0_1] step 3: validate
    [root_0_1] validate score=[{'accuracy': 0.8373205741626795}]
  [root_0_1] validate → 0.8373

  --- Branch root_0_2 (p=0.00) ---
  Strategy: Temperature sample 2
    [root_0_2] step 0: cat << 'ENDOFFILE' > train_and_predict.py
import pandas as pd
import numpy as np
    [root_0_2] step 1: validate
    [root_0_2] validate score=[]
    [root_0_2] step 2: python train_and_predict.py
    [root_0_2] step 3: validate
    [root_0_2] validate score=[{'accuracy': 0.8373205741626795}]
  [root_0_2] validate → 0.8373

  Branching root_1 (score=0.7608) without verbalized sampling...

  --- Branch root_1_0 (p=0.00) ---
  Strategy: Temperature sample 0
    [root_1_0] step 0: cat << 'ENDOFFILE' > train_and_predict.py
import pandas as pd
import numpy as np
    [root_1_0] step 1: python train_and_predict.py
    [root_1_0] step 2: validate
    [root_1_0] validate score=[{'accuracy': 0.7966507177033493}]
  [root_1_0] validate → 0.7967

  --- Branch root_1_1 (p=0.00) ---
  Strategy: Temperature sample 1
    [root_1_1] step 0: cat << 'ENDOFFILE' > train_and_predict.py
import pandas as pd
import numpy as np
    [root_1_1] step 1: validate
    [root_1_1] validate score=[]
    [root_1_1] step 2: python train_and_predict.py
    [root_1_1] step 3: validate
    [root_1_1] validate score=[{'accuracy': 0.7966507177033493}]
  [root_1_1] validate → 0.7967

  --- Branch root_1_2 (p=0.00) ---
  Strategy: Temperature sample 2
    [root_1_2] step 0: cat << 'ENDOFFILE' > train_and_predict.py
import pandas as pd
import numpy as np
    [root_1_2] step 1: validate
    [root_1_2] validate score=[]
    [root_1_2] step 2: python train_and_predict.py
    [root_1_2] step 3: validate
    [root_1_2] validate score=[{'accuracy': 0.7918660287081339}]
  [root_1_2] validate → 0.7919

  Branching root_2 (score=0.7919) without verbalized sampling...

  --- Branch root_2_0 (p=0.00) ---
  Strategy: Temperature sample 0
    [root_2_0] step 0: cat << 'ENDOFFILE' > train_and_predict.py
import pandas as pd
import numpy as np
    [root_2_0] step 1: python train_and_predict.py
    [root_2_0] python ERROR: /mlgym_generic/lib/python3.11/site-packages/pandas/core/indexes/base.py", line 7070, in drop
    raise KeyError(f"{labels[mask].tolist()} not found in
    [root_2_0] step 2: cat << 'ENDOFFILE' > train_and_predict.py
import pandas as pd
import numpy as np
    [root_2_0] step 3: python train_and_predict.py
    [root_2_0] step 4: validate
    [root_2_0] validate score=[{'accuracy': 0.7942583732057417}]
  [root_2_0] validate → 0.7943

  --- Branch root_2_1 (p=0.00) ---
  Strategy: Temperature sample 1
    [root_2_1] step 0: cat << 'ENDOFFILE' > train_and_predict.py
import pandas as pd
import numpy as np
    [root_2_1] validate score=[]
    [root_2_1] step 1: python train_and_predict.py
    [root_2_1] python ERROR: /mlgym_generic/lib/python3.11/site-packages/pandas/core/indexes/base.py", line 7070, in drop
    raise KeyError(f"{labels[mask].tolist()} not found in
    [root_2_1] step 2: cat << 'ENDOFFILE' > train_and_predict.py
import pandas as pd
import numpy as np
    [root_2_1] validate score=[]
    [root_2_1] step 3: python train_and_predict.py
    [root_2_1] step 4: validate
    [root_2_1] validate score=[{'accuracy': 0.8492822966507177}]
  [root_2_1] validate → 0.8493

  --- Branch root_2_2 (p=0.00) ---
  Strategy: Temperature sample 2
    [root_2_2] step 0: cat << 'ENDOFFILE' > train_and_predict.py
import pandas as pd
import numpy as np
    [root_2_2] step 1: python train_and_predict.py
    [root_2_2] step 2: validate
    [root_2_2] validate score=[{'accuracy': 0.854066985645933}]
  [root_2_2] validate → 0.8541

======================================================================
TREE SEARCH RESULTS
======================================================================
Baseline: 0.7655 | Best: 0.8541 (node: root_2_2) | Improvement: +0.0885
Nodes explored: 13
======================================================================

└── root [0.8493] Initial solution
    ├── root_0 [0.8206] Temperature sample 0
    │   ├── root_0_0 [0.8278] Temperature sample 0
    │   ├── root_0_1 [0.8373] Temperature sample 1
    │   └── root_0_2 [0.8373] Temperature sample 2
    ├── root_1 [0.7608] Temperature sample 1
    │   ├── root_1_0 [0.7967] Temperature sample 0
    │   ├── root_1_1 [0.7967] Temperature sample 1
    │   └── root_1_2 [0.7919] Temperature sample 2
    └── root_2 [0.7919] Temperature sample 2
        ├── root_2_0 [0.7943] Temperature sample 0
        ├── root_2_1 [0.8493] Temperature sample 1
        └── root_2_2 [0.8541] Temperature sample 2 *** BEST ***

Best path: root -> root_2 -> root_2_2
  root: [0.8493] Initial solution
  root_2: [0.7919] Temperature sample 2
  root_2_2: [0.8541] Temperature sample 2

Results saved to outputs/tree_search/exp2.0/run1/result.json
