Setting up logger for name='MLGym'
Setting up logger for name='env_utils'
============================================================
Experiment 2: Tree Search WITHOUT Verbalized Sampling
============================================================
Model: Qwen/Qwen3-4B-Instruct-2507
Branching: 3, Depth: 2
Max actions/node: 15
Temperature: 0.9
Verbalized sampling: False

Creating MLGym container...
Setting up logger for name='MLGymEnv'
INFO     Found image aigym/mlgym-agent:latest with tags:                        
         ['aigym/mlgym-agent:latest'], created: 2024-11-04T13:33:17.818245514Z  
         for linux amd64.                                                       
DEBUG    Starting container with command: docker run -i --rm --network host     
         --gpus '"device=7"' --name aigym-mlgym-agent-latest-d_7-1dfa377241     
         aigym/mlgym-agent:latest /bin/bash -l                                  
Setting up logger for name='MLGymTask'
DEBUG    Copying data/titanic/data to container at /home/agent/workspace/data   
         with command: docker cp data/titanic/data                              
         d367c68354a01c5867774ce4ad7d1393027cd4b7ad3b657754fd99cb2af8cc9e:/home/
         agent/workspace/data                                                   
DEBUG    Setting agent as owner of copied files at /home/agent/workspace/data   
         with command: docker exec -u root                                      
         d367c68354a01c5867774ce4ad7d1393027cd4b7ad3b657754fd99cb2af8cc9e chown 
         -R agent:mlgym /home/agent/workspace/data                              
DEBUG    Copying data/titanic/evaluate.py to container at /home/agent/workspace/
         with command: docker cp data/titanic/evaluate.py                       
         d367c68354a01c5867774ce4ad7d1393027cd4b7ad3b657754fd99cb2af8cc9e:/home/
         agent/workspace/                                                       
DEBUG    Setting agent as owner of copied files at /home/agent/workspace/ with  
         command: docker exec -u root                                           
         d367c68354a01c5867774ce4ad7d1393027cd4b7ad3b657754fd99cb2af8cc9e chown 
         -R agent:mlgym /home/agent/workspace/                                  
DEBUG    Copying /tmp/tmpj5rzq9mt to container at                               
         /home/agent/commands/defaults.sh with command: docker cp               
         /tmp/tmpj5rzq9mt                                                       
         d367c68354a01c5867774ce4ad7d1393027cd4b7ad3b657754fd99cb2af8cc9e:/home/
         agent/commands/defaults.sh                                             
DEBUG    Setting agent as owner of copied files at                              
         /home/agent/commands/defaults.sh with command: docker exec -u root     
         d367c68354a01c5867774ce4ad7d1393027cd4b7ad3b657754fd99cb2af8cc9e chown 
         -R agent:mlgym /home/agent/commands/defaults.sh                        
DEBUG    Copying /tmp/tmp6xver2do to container at /home/agent/commands/search.sh
         with command: docker cp /tmp/tmp6xver2do                               
         d367c68354a01c5867774ce4ad7d1393027cd4b7ad3b657754fd99cb2af8cc9e:/home/
         agent/commands/search.sh                                               
DEBUG    Setting agent as owner of copied files at                              
         /home/agent/commands/search.sh with command: docker exec -u root       
         d367c68354a01c5867774ce4ad7d1393027cd4b7ad3b657754fd99cb2af8cc9e chown 
         -R agent:mlgym /home/agent/commands/search.sh                          
DEBUG    Copying /tmp/tmpruvc5i7u to container at                               
         /home/agent/commands/edit_linting.sh with command: docker cp           
         /tmp/tmpruvc5i7u                                                       
         d367c68354a01c5867774ce4ad7d1393027cd4b7ad3b657754fd99cb2af8cc9e:/home/
         agent/commands/edit_linting.sh                                         
DEBUG    Setting agent as owner of copied files at                              
         /home/agent/commands/edit_linting.sh with command: docker exec -u root 
         d367c68354a01c5867774ce4ad7d1393027cd4b7ad3b657754fd99cb2af8cc9e chown 
         -R agent:mlgym /home/agent/commands/edit_linting.sh                    
DEBUG    Copying /tmp/tmpch78zw1d to container at                               
         /home/agent/commands/validate.sh with command: docker cp               
         /tmp/tmpch78zw1d                                                       
         d367c68354a01c5867774ce4ad7d1393027cd4b7ad3b657754fd99cb2af8cc9e:/home/
         agent/commands/validate.sh                                             
DEBUG    Setting agent as owner of copied files at                              
         /home/agent/commands/validate.sh with command: docker exec -u root     
         d367c68354a01c5867774ce4ad7d1393027cd4b7ad3b657754fd99cb2af8cc9e chown 
         -R agent:mlgym /home/agent/commands/validate.sh                        
DEBUG    Copying /tmp/tmps8i1ul3w to container at /home/agent/commands/submit.sh
         with command: docker cp /tmp/tmps8i1ul3w                               
         d367c68354a01c5867774ce4ad7d1393027cd4b7ad3b657754fd99cb2af8cc9e:/home/
         agent/commands/submit.sh                                               
DEBUG    Setting agent as owner of copied files at                              
         /home/agent/commands/submit.sh with command: docker exec -u root       
         d367c68354a01c5867774ce4ad7d1393027cd4b7ad3b657754fd99cb2af8cc9e chown 
         -R agent:mlgym /home/agent/commands/submit.sh                          
Container created. Baseline: 0.7655

============================================================
TREE SEARCH - Root Node
============================================================
    [root] step 0: cat << 'ENDOFFILE' > train_and_predict.py
import pandas as pd
import numpy as np
    [root] step 1: validate
    [root] validate score=[]
    [root] step 2: python train_and_predict.py
    [root] python ERROR: site-packages/pandas/core/generic.py", line 2153, in __array__
    arr = np.asarray(values, dtype=dtype)
          ^^^^^^^^^^^^^^^^^^^^^^^^^^^^^^^
Val
    [root] step 3: cat << 'ENDOFFILE' > train_and_predict.py
import pandas as pd
import numpy as np
    [root] step 4: validate
    [root] validate score=[]
    [root] step 5: python train_and_predict.py
    [root] python ERROR: iconda3/envs/mlgym_generic/lib/python3.11/site-packages/pandas/core/indexes/base.py", line 6252, in _raise_if_missing
    raise KeyError(f"{not_found}
    [root] step 6: cat << 'ENDOFFILE' > train_and_predict.py
import pandas as pd
import numpy as np
    [root] step 7: validate
    [root] validate score=[]
    [root] step 8: python train_and_predict.py
    [root] step 9: validate
    [root] validate score=[{'accuracy': 0.8373205741626795}]
  [root] validate → 0.8373

============================================================
TREE SEARCH - Depth 1 (1 nodes to expand)
============================================================

  Branching root (score=0.8373) without verbalized sampling...

  --- Branch root_0 (p=0.00) ---
  Strategy: Temperature sample 0
    [root_0] step 0: cat << 'ENDOFFILE' > train_and_predict.py
import pandas as pd
import numpy as np
    [root_0] step 1: python train_and_predict.py
    [root_0] step 2: validate
    [root_0] validate score=[{'accuracy': 0.8971291866028708}]
  [root_0] validate → 0.8971

  --- Branch root_1 (p=0.00) ---
  Strategy: Temperature sample 1
    [root_1] step 0: cat << 'ENDOFFILE' > train_and_predict.py
import pandas as pd
import numpy as np
    [root_1] step 1: validate
    [root_1] validate score=[]
    [root_1] step 2: python train_and_predict.py
    [root_1] step 3: validate
    [root_1] validate score=[{'accuracy': 0.8971291866028708}]
  [root_1] validate → 0.8971

  --- Branch root_2 (p=0.00) ---
  Strategy: Temperature sample 2
    [root_2] step 0: cat << 'ENDOFFILE' > train_and_predict.py
import pandas as pd
import numpy as np
    [root_2] step 1: validate
    [root_2] validate score=[]
    [root_2] step 2: python train_and_predict.py
    [root_2] step 3: validate
    [root_2] validate score=[{'accuracy': 0.8971291866028708}]
  [root_2] validate → 0.8971

============================================================
TREE SEARCH - Depth 2 (3 nodes to expand)
============================================================

  Branching root_0 (score=0.8971) without verbalized sampling...

  --- Branch root_0_0 (p=0.00) ---
  Strategy: Temperature sample 0
    [root_0_0] step 0: cat << 'ENDOFFILE' > train_and_predict.py
import pandas as pd
import numpy as np
    [root_0_0] step 1: python train_and_predict.py
    [root_0_0] step 2: validate
    [root_0_0] validate score=[{'accuracy': 0.8995215311004785}]
  [root_0_0] validate → 0.8995

  --- Branch root_0_1 (p=0.00) ---
  Strategy: Temperature sample 1
    [root_0_1] step 0: cat << 'ENDOFFILE' > train_and_predict.py
import pandas as pd
import numpy as np
    [root_0_1] step 1: python train_and_predict.py
    [root_0_1] step 2: validate
    [root_0_1] validate score=[{'accuracy': 0.8708133971291866}]
  [root_0_1] validate → 0.8708

  --- Branch root_0_2 (p=0.00) ---
  Strategy: Temperature sample 2
    [root_0_2] step 0: cat << 'ENDOFFILE' > train_and_predict.py
import pandas as pd
import numpy as np
    [root_0_2] step 1: python train_and_predict.py
    [root_0_2] python ERROR: 11/site-packages/pandas/core/generic.py", line 2153, in __array__
    arr = np.asarray(values, dtype=dtype)
          ^^^^^^^^^^^^^^^^^^^^^^^^^^^^^^^

    [root_0_2] step 2: cat << 'ENDOFFILE' > train_and_predict.py
import pandas as pd
import numpy as np
    [root_0_2] step 3: python train_and_predict.py
    [root_0_2] python ERROR: 11/site-packages/pandas/core/generic.py", line 2153, in __array__
    arr = np.asarray(values, dtype=dtype)
          ^^^^^^^^^^^^^^^^^^^^^^^^^^^^^^^

    [root_0_2] step 4: cat << 'ENDOFFILE' > train_and_predict.py
import pandas as pd
import numpy as np
    [root_0_2] step 5: python train_and_predict.py
    [root_0_2] python ERROR: 11/site-packages/pandas/core/generic.py", line 2153, in __array__
    arr = np.asarray(values, dtype=dtype)
          ^^^^^^^^^^^^^^^^^^^^^^^^^^^^^^^

    [root_0_2] step 6: cat << 'ENDOFFILE' > train_and_predict.py
import pandas as pd
import numpy as np
    [root_0_2] step 7: python train_and_predict.py
    [root_0_2] python ERROR: 11/site-packages/pandas/core/generic.py", line 2153, in __array__
    arr = np.asarray(values, dtype=dtype)
          ^^^^^^^^^^^^^^^^^^^^^^^^^^^^^^^

    [root_0_2] step 8: cat << 'ENDOFFILE' > train_and_predict.py
import pandas as pd
import numpy as np
    [root_0_2] step 9: python train_and_predict.py
    [root_0_2] python ERROR: 11/site-packages/pandas/core/generic.py", line 2153, in __array__
    arr = np.asarray(values, dtype=dtype)
          ^^^^^^^^^^^^^^^^^^^^^^^^^^^^^^^

    [root_0_2] step 10: cat << 'ENDOFFILE' > train_and_predict.py
import pandas as pd
import numpy as np
    [root_0_2] step 11: python train_and_predict.py
    [root_0_2] python ERROR: 11/site-packages/pandas/core/generic.py", line 2153, in __array__
    arr = np.asarray(values, dtype=dtype)
          ^^^^^^^^^^^^^^^^^^^^^^^^^^^^^^^

    [root_0_2] step 12: cat << 'ENDOFFILE' > train_and_predict.py
import pandas as pd
import numpy as np
    [root_0_2] step 13: python train_and_predict.py
    [root_0_2] python ERROR: 11/site-packages/pandas/core/generic.py", line 2153, in __array__
    arr = np.asarray(values, dtype=dtype)
          ^^^^^^^^^^^^^^^^^^^^^^^^^^^^^^^

    [root_0_2] step 14: cat << 'ENDOFFILE' > train_and_predict.py
import pandas as pd
import numpy as np
  [root_0_2] Max actions reached, forcing validate

  Branching root_1 (score=0.8971) without verbalized sampling...

  --- Branch root_1_0 (p=0.00) ---
  Strategy: Temperature sample 0
    [root_1_0] step 0: cat << 'ENDOFFILE' > train_and_predict.py
import pandas as pd
import numpy as np
    [root_1_0] step 1: validate
    [root_1_0] validate score=[]
    [root_1_0] step 2: python train_and_predict.py
    [root_1_0] step 3: validate
    [root_1_0] validate score=[{'accuracy': 0.9545454545454546}]
  [root_1_0] validate → 0.9545

  --- Branch root_1_1 (p=0.00) ---
  Strategy: Temperature sample 1
    [root_1_1] step 0: cat << 'ENDOFFILE' > train_and_predict.py
import pandas as pd
import numpy as np
    [root_1_1] step 1: validate
    [root_1_1] validate score=[]
    [root_1_1] step 2: python train_and_predict.py
    [root_1_1] step 3: validate
    [root_1_1] validate score=[{'accuracy': 0.8947368421052632}]
  [root_1_1] validate → 0.8947

  --- Branch root_1_2 (p=0.00) ---
  Strategy: Temperature sample 2
    [root_1_2] step 0: cat << 'ENDOFFILE' > train_and_predict.py
import pandas as pd
import numpy as np
    [root_1_2] step 1: validate
    [root_1_2] validate score=[]
    [root_1_2] step 2: python train_and_predict.py
    [root_1_2] step 3: validate
    [root_1_2] validate score=[{'accuracy': 0.9138755980861244}]
  [root_1_2] validate → 0.9139

  Branching root_2 (score=0.8971) without verbalized sampling...

  --- Branch root_2_0 (p=0.00) ---
  Strategy: Temperature sample 0
    [root_2_0] step 0: cat << 'ENDOFFILE' > train_and_predict.py
import pandas as pd
import numpy as np
    [root_2_0] step 1: python train_and_predict.py
    [root_2_0] step 2: validate
    [root_2_0] validate score=[{'accuracy': 0.8779904306220095}]
  [root_2_0] validate → 0.8780

  --- Branch root_2_1 (p=0.00) ---
  Strategy: Temperature sample 1
    [root_2_1] step 0: cat << 'ENDOFFILE' > train_and_predict.py
import pandas as pd
import numpy as np
    [root_2_1] step 1: validate
    [root_2_1] validate score=[]
    [root_2_1] step 2: python train_and_predict.py
    [root_2_1] step 3: validate
    [root_2_1] validate score=[{'accuracy': 0.9066985645933014}]
  [root_2_1] validate → 0.9067

  --- Branch root_2_2 (p=0.00) ---
  Strategy: Temperature sample 2
    [root_2_2] step 0: cat << 'ENDOFFILE' > train_and_predict.py
import pandas as pd
import numpy as np
    [root_2_2] step 1: python train_and_predict.py
    [root_2_2] python ERROR: 11/site-packages/pandas/core/generic.py", line 2153, in __array__
    arr = np.asarray(values, dtype=dtype)
          ^^^^^^^^^^^^^^^^^^^^^^^^^^^^^^^

    [root_2_2] step 2: cat << 'ENDOFFILE' > train_and_predict.py
import pandas as pd
import numpy as np
    [root_2_2] step 3: python train_and_predict.py
    [root_2_2] python ERROR: 11/site-packages/pandas/core/generic.py", line 2153, in __array__
    arr = np.asarray(values, dtype=dtype)
          ^^^^^^^^^^^^^^^^^^^^^^^^^^^^^^^

    [root_2_2] step 4: cat << 'ENDOFFILE' > train_and_predict.py
import pandas as pd
import numpy as np
    [root_2_2] step 5: python train_and_predict.py
    [root_2_2] python ERROR: 11/site-packages/pandas/core/generic.py", line 2153, in __array__
    arr = np.asarray(values, dtype=dtype)
          ^^^^^^^^^^^^^^^^^^^^^^^^^^^^^^^

    [root_2_2] step 6: cat << 'ENDOFFILE' > train_and_predict.py
import pandas as pd
import numpy as np
    [root_2_2] step 7: python train_and_predict.py
    [root_2_2] python ERROR: c/lib/python3.11/site-packages/sklearn/utils/validation.py", line 457, in check_consistent_length
    raise ValueError(
ValueError: Found input variab
    [root_2_2] step 8: cat << 'ENDOFFILE' > train_and_predict.py
import pandas as pd
import numpy as np
    [root_2_2] step 9: python train_and_predict.py
    [root_2_2] python ERROR: c/lib/python3.11/site-packages/sklearn/utils/validation.py", line 457, in check_consistent_length
    raise ValueError(
ValueError: Found input variab
    [root_2_2] step 10: cat << 'ENDOFFILE' > train_and_predict.py
import pandas as pd
import numpy as np
    [root_2_2] step 11: python train_and_predict.py
    [root_2_2] python ERROR: e-packages/pandas/core/generic.py", line 2153, in __array__
    arr = np.asarray(values, dtype=dtype)
          ^^^^^^^^^^^^^^^^^^^^^^^^^^^^^^^
ValueE
    [root_2_2] step 12: cat << 'ENDOFFILE' > train_and_predict.py
import pandas as pd
import numpy as np
    [root_2_2] step 13: python train_and_predict.py
    [root_2_2] python ERROR: e-packages/pandas/core/generic.py", line 2153, in __array__
    arr = np.asarray(values, dtype=dtype)
          ^^^^^^^^^^^^^^^^^^^^^^^^^^^^^^^
ValueE
    [root_2_2] step 14: cat << 'ENDOFFILE' > train_and_predict.py
import pandas as pd
import numpy as np
  [root_2_2] Max actions reached, forcing validate

======================================================================
TREE SEARCH RESULTS
======================================================================
Baseline: 0.7655 | Best: 0.9545 (node: root_1_0) | Improvement: +0.1890
Nodes explored: 13
======================================================================

└── root [0.8373] Initial solution
    ├── root_0 [0.8971] Temperature sample 0
    │   ├── root_0_0 [0.8995] Temperature sample 0
    │   ├── root_0_1 [0.8708] Temperature sample 1
    │   └── root_0_2 [FAIL] Temperature sample 2
    ├── root_1 [0.8971] Temperature sample 1
    │   ├── root_1_0 [0.9545] Temperature sample 0 *** BEST ***
    │   ├── root_1_1 [0.8947] Temperature sample 1
    │   └── root_1_2 [0.9139] Temperature sample 2
    └── root_2 [0.8971] Temperature sample 2
        ├── root_2_0 [0.8780] Temperature sample 0
        ├── root_2_1 [0.9067] Temperature sample 1
        └── root_2_2 [FAIL] Temperature sample 2

Best path: root -> root_1 -> root_1_0
  root: [0.8373] Initial solution
  root_1: [0.8971] Temperature sample 1
  root_1_0: [0.9545] Temperature sample 0

Results saved to outputs/tree_search/exp2.0/run2/result.json
