Setting up logger for name='MLGym'
Setting up logger for name='env_utils'
============================================================
Experiment 2: Tree Search WITHOUT Verbalized Sampling
============================================================
Model: Qwen/Qwen3-4B-Instruct-2507
Branching: 3, Depth: 2
Max actions/node: 15
Temperature: 0.9
Verbalized sampling: False

Creating MLGym container...
Setting up logger for name='MLGymEnv'
INFO     Found image aigym/mlgym-agent:latest with tags:                        
         ['aigym/mlgym-agent:latest'], created: 2024-11-04T13:33:17.818245514Z  
         for linux amd64.                                                       
DEBUG    Starting container with command: docker run -i --rm --network host     
         --gpus '"device=7"' --name aigym-mlgym-agent-latest-d_7-481b7b7013     
         aigym/mlgym-agent:latest /bin/bash -l                                  
Setting up logger for name='MLGymTask'
DEBUG    Copying data/titanic/data to container at /home/agent/workspace/data   
         with command: docker cp data/titanic/data                              
         ee8915d34cb208fb9c404933661bcc1e37212a1abe43e7df98f0d9ca77d78165:/home/
         agent/workspace/data                                                   
DEBUG    Setting agent as owner of copied files at /home/agent/workspace/data   
         with command: docker exec -u root                                      
         ee8915d34cb208fb9c404933661bcc1e37212a1abe43e7df98f0d9ca77d78165 chown 
         -R agent:mlgym /home/agent/workspace/data                              
DEBUG    Copying data/titanic/evaluate.py to container at /home/agent/workspace/
         with command: docker cp data/titanic/evaluate.py                       
         ee8915d34cb208fb9c404933661bcc1e37212a1abe43e7df98f0d9ca77d78165:/home/
         agent/workspace/                                                       
DEBUG    Setting agent as owner of copied files at /home/agent/workspace/ with  
         command: docker exec -u root                                           
         ee8915d34cb208fb9c404933661bcc1e37212a1abe43e7df98f0d9ca77d78165 chown 
         -R agent:mlgym /home/agent/workspace/                                  
DEBUG    Copying /tmp/tmp9ii3jldb to container at                               
         /home/agent/commands/defaults.sh with command: docker cp               
         /tmp/tmp9ii3jldb                                                       
         ee8915d34cb208fb9c404933661bcc1e37212a1abe43e7df98f0d9ca77d78165:/home/
         agent/commands/defaults.sh                                             
DEBUG    Setting agent as owner of copied files at                              
         /home/agent/commands/defaults.sh with command: docker exec -u root     
         ee8915d34cb208fb9c404933661bcc1e37212a1abe43e7df98f0d9ca77d78165 chown 
         -R agent:mlgym /home/agent/commands/defaults.sh                        
DEBUG    Copying /tmp/tmpavvlrdgk to container at /home/agent/commands/search.sh
         with command: docker cp /tmp/tmpavvlrdgk                               
         ee8915d34cb208fb9c404933661bcc1e37212a1abe43e7df98f0d9ca77d78165:/home/
         agent/commands/search.sh                                               
DEBUG    Setting agent as owner of copied files at                              
         /home/agent/commands/search.sh with command: docker exec -u root       
         ee8915d34cb208fb9c404933661bcc1e37212a1abe43e7df98f0d9ca77d78165 chown 
         -R agent:mlgym /home/agent/commands/search.sh                          
DEBUG    Copying /tmp/tmp7i04ors8 to container at                               
         /home/agent/commands/edit_linting.sh with command: docker cp           
         /tmp/tmp7i04ors8                                                       
         ee8915d34cb208fb9c404933661bcc1e37212a1abe43e7df98f0d9ca77d78165:/home/
         agent/commands/edit_linting.sh                                         
DEBUG    Setting agent as owner of copied files at                              
         /home/agent/commands/edit_linting.sh with command: docker exec -u root 
         ee8915d34cb208fb9c404933661bcc1e37212a1abe43e7df98f0d9ca77d78165 chown 
         -R agent:mlgym /home/agent/commands/edit_linting.sh                    
DEBUG    Copying /tmp/tmpmoi2vz8s to container at                               
         /home/agent/commands/validate.sh with command: docker cp               
         /tmp/tmpmoi2vz8s                                                       
         ee8915d34cb208fb9c404933661bcc1e37212a1abe43e7df98f0d9ca77d78165:/home/
         agent/commands/validate.sh                                             
DEBUG    Setting agent as owner of copied files at                              
         /home/agent/commands/validate.sh with command: docker exec -u root     
         ee8915d34cb208fb9c404933661bcc1e37212a1abe43e7df98f0d9ca77d78165 chown 
         -R agent:mlgym /home/agent/commands/validate.sh                        
DEBUG    Copying /tmp/tmpcf70lq65 to container at /home/agent/commands/submit.sh
         with command: docker cp /tmp/tmpcf70lq65                               
         ee8915d34cb208fb9c404933661bcc1e37212a1abe43e7df98f0d9ca77d78165:/home/
         agent/commands/submit.sh                                               
DEBUG    Setting agent as owner of copied files at                              
         /home/agent/commands/submit.sh with command: docker exec -u root       
         ee8915d34cb208fb9c404933661bcc1e37212a1abe43e7df98f0d9ca77d78165 chown 
         -R agent:mlgym /home/agent/commands/submit.sh                          
Container created. Baseline: 0.7655

============================================================
TREE SEARCH - Root Node
============================================================
    [root] step 0: cat << 'ENDOFFILE' > train_and_predict.py
import pandas as pd
import numpy as np
    [root] step 1: validate
    [root] validate score=[]
    [root] step 2: python train_and_predict.py
    [root] python ERROR: dtypes/astype.py", line 133, in _astype_nansafe
    return arr.astype(dtype, copy=True)
           ^^^^^^^^^^^^^^^^^^^^^^^^^^^^
ValueError: could not 
    [root] step 3: cat << 'ENDOFFILE' > train_and_predict.py
import pandas as pd
import numpy as np
    [root] step 4: validate
    [root] validate score=[]
    [root] step 5: python train_and_predict.py
    [root] python ERROR: s/pandas/core/dtypes/astype.py", line 133, in _astype_nansafe
    return arr.astype(dtype, copy=True)
           ^^^^^^^^^^^^^^^^^^^^^^^^^^^^
ValueErr
    [root] step 6: cat << 'ENDOFFILE' > train_and_predict.py
import pandas as pd
import numpy as np
    [root] step 7: validate
    [root] validate score=[]
    [root] step 8: python train_and_predict.py
    [root] step 9: validate
    [root] validate score=[{'accuracy': 0.8110047846889952}]
  [root] validate → 0.8110

============================================================
TREE SEARCH - Depth 1 (1 nodes to expand)
============================================================

  Branching root (score=0.8110) without verbalized sampling...

  --- Branch root_0 (p=0.00) ---
  Strategy: Temperature sample 0
    [root_0] step 0: cat << 'ENDOFFILE' > train_and_predict.py
import pandas as pd
import numpy as np
    [root_0] step 1: python train_and_predict.py
    [root_0] step 2: validate
    [root_0] validate score=[{'accuracy': 0.8779904306220095}]
  [root_0] validate → 0.8780

  --- Branch root_1 (p=0.00) ---
  Strategy: Temperature sample 1
    [root_1] step 0: cat << 'ENDOFFILE' > train_and_predict.py
import pandas as pd
import numpy as np
    [root_1] step 1: python train_and_predict.py
    [root_1] step 2: validate
    [root_1] validate score=[{'accuracy': 0.8564593301435407}]
  [root_1] validate → 0.8565

  --- Branch root_2 (p=0.00) ---
  Strategy: Temperature sample 2
    [root_2] step 0: cat << 'ENDOFFILE' > train_and_predict.py
import pandas as pd
import numpy as np
    [root_2] step 1: python train_and_predict.py
    [root_2] step 2: validate
    [root_2] validate score=[{'accuracy': 0.8564593301435407}]
  [root_2] validate → 0.8565

============================================================
TREE SEARCH - Depth 2 (3 nodes to expand)
============================================================

  Branching root_0 (score=0.8780) without verbalized sampling...

  --- Branch root_0_0 (p=0.00) ---
  Strategy: Temperature sample 0
    [root_0_0] step 0: cat << 'ENDOFFILE' > train_and_predict.py
import pandas as pd
import numpy as np
    [root_0_0] step 1: python train_and_predict.py
    [root_0_0] step 2: validate
    [root_0_0] validate score=[{'accuracy': 0.8660287081339713}]
  [root_0_0] validate → 0.8660

  --- Branch root_0_1 (p=0.00) ---
  Strategy: Temperature sample 1
    [root_0_1] step 0: cat << 'ENDOFFILE' > train_and_predict.py
import pandas as pd
import numpy as np
    [root_0_1] step 1: python train_and_predict.py
    [root_0_1] step 2: validate
    [root_0_1] validate score=[{'accuracy': 0.8564593301435407}]
  [root_0_1] validate → 0.8565

  --- Branch root_0_2 (p=0.00) ---
  Strategy: Temperature sample 2
    [root_0_2] step 0: cat << 'ENDOFFILE' > train_and_predict.py
import pandas as pd
import numpy as np
    [root_0_2] step 1: python train_and_predict.py
    [root_0_2] step 2: validate
    [root_0_2] validate score=[{'accuracy': 0.8588516746411483}]
  [root_0_2] validate → 0.8589

  Branching root_1 (score=0.8565) without verbalized sampling...

  --- Branch root_1_0 (p=0.00) ---
  Strategy: Temperature sample 0
    [root_1_0] step 0: cat << 'ENDOFFILE' > train_and_predict.py
import pandas as pd
import numpy as np
    [root_1_0] step 1: python train_and_predict.py
    [root_1_0] step 2: validate
    [root_1_0] validate score=[{'accuracy': 0.8492822966507177}]
  [root_1_0] validate → 0.8493

  --- Branch root_1_1 (p=0.00) ---
  Strategy: Temperature sample 1
    [root_1_1] step 0: cat << 'ENDOFFILE' > train_and_predict.py
import pandas as pd
import numpy as np
    [root_1_1] step 1: python train_and_predict.py
    [root_1_1] step 2: validate
    [root_1_1] validate score=[{'accuracy': 0.8492822966507177}]
  [root_1_1] validate → 0.8493

  --- Branch root_1_2 (p=0.00) ---
  Strategy: Temperature sample 2
    [root_1_2] step 0: cat << 'ENDOFFILE' > train_and_predict.py
import pandas as pd
import numpy as np
    [root_1_2] step 1: python train_and_predict.py
    [root_1_2] step 2: validate
    [root_1_2] validate score=[{'accuracy': 0.8492822966507177}]
  [root_1_2] validate → 0.8493

  Branching root_2 (score=0.8565) without verbalized sampling...

  --- Branch root_2_0 (p=0.00) ---
  Strategy: Temperature sample 0
    [root_2_0] step 0: cat << 'ENDOFFILE' > train_and_predict.py
import pandas as pd
import numpy as np
    [root_2_0] step 1: python train_and_predict.py
    [root_2_0] step 2: validate
    [root_2_0] validate score=[{'accuracy': 0.8492822966507177}]
  [root_2_0] validate → 0.8493

  --- Branch root_2_1 (p=0.00) ---
  Strategy: Temperature sample 1
    [root_2_1] step 0: cat << 'ENDOFFILE' > train_and_predict.py
import pandas as pd
import numpy as np
    [root_2_1] step 1: python train_and_predict.py
    [root_2_1] step 2: validate
    [root_2_1] validate score=[{'accuracy': 0.8492822966507177}]
  [root_2_1] validate → 0.8493

  --- Branch root_2_2 (p=0.00) ---
  Strategy: Temperature sample 2
    [root_2_2] step 0: cat << 'ENDOFFILE' > train_and_predict.py
import pandas as pd
import numpy as np
    [root_2_2] step 1: python train_and_predict.py
    [root_2_2] step 2: validate
    [root_2_2] validate score=[{'accuracy': 0.8492822966507177}]
  [root_2_2] validate → 0.8493

======================================================================
TREE SEARCH RESULTS
======================================================================
Baseline: 0.7655 | Best: 0.8780 (node: root_0) | Improvement: +0.1124
Nodes explored: 13
======================================================================

└── root [0.8110] Initial solution
    ├── root_0 [0.8780] Temperature sample 0 *** BEST ***
    │   ├── root_0_0 [0.8660] Temperature sample 0
    │   ├── root_0_1 [0.8565] Temperature sample 1
    │   └── root_0_2 [0.8589] Temperature sample 2
    ├── root_1 [0.8565] Temperature sample 1
    │   ├── root_1_0 [0.8493] Temperature sample 0
    │   ├── root_1_1 [0.8493] Temperature sample 1
    │   └── root_1_2 [0.8493] Temperature sample 2
    └── root_2 [0.8565] Temperature sample 2
        ├── root_2_0 [0.8493] Temperature sample 0
        ├── root_2_1 [0.8493] Temperature sample 1
        └── root_2_2 [0.8493] Temperature sample 2

Best path: root -> root_0
  root: [0.8110] Initial solution
  root_0: [0.8780] Temperature sample 0

Results saved to outputs/tree_search/exp2.0/run4/result.json
