Setting up logger for name='MLGym'
Setting up logger for name='env_utils'
============================================================
Experiment 2: Tree Search with VS (tail-distribution)
============================================================
Model: Qwen/Qwen3-4B-Instruct-2507
Branching: 3, Depth: 2
Max actions/node: 15
Temperature: 0.9
Verbalized sampling: True (mode: tail)

Creating MLGym container...
Setting up logger for name='MLGymEnv'
INFO     Found image aigym/mlgym-agent:latest with tags:                        
         ['aigym/mlgym-agent:latest'], created: 2024-11-04T13:33:17.818245514Z  
         for linux amd64.                                                       
DEBUG    Starting container with command: docker run -i --rm --network host     
         --gpus '"device=7"' --name aigym-mlgym-agent-latest-d_7-509ea8f4b7     
         aigym/mlgym-agent:latest /bin/bash -l                                  
Setting up logger for name='MLGymTask'
DEBUG    Copying data/titanic/data to container at /home/agent/workspace/data   
         with command: docker cp data/titanic/data                              
         4a09909273e9c75402b5c69d5c832cb6d0f6ee1846d08ad1d5dd7e47dd5c8eb8:/home/
         agent/workspace/data                                                   
DEBUG    Setting agent as owner of copied files at /home/agent/workspace/data   
         with command: docker exec -u root                                      
         4a09909273e9c75402b5c69d5c832cb6d0f6ee1846d08ad1d5dd7e47dd5c8eb8 chown 
         -R agent:mlgym /home/agent/workspace/data                              
DEBUG    Copying data/titanic/evaluate.py to container at /home/agent/workspace/
         with command: docker cp data/titanic/evaluate.py                       
         4a09909273e9c75402b5c69d5c832cb6d0f6ee1846d08ad1d5dd7e47dd5c8eb8:/home/
         agent/workspace/                                                       
DEBUG    Setting agent as owner of copied files at /home/agent/workspace/ with  
         command: docker exec -u root                                           
         4a09909273e9c75402b5c69d5c832cb6d0f6ee1846d08ad1d5dd7e47dd5c8eb8 chown 
         -R agent:mlgym /home/agent/workspace/                                  
DEBUG    Copying /tmp/tmp3nl3omt1 to container at                               
         /home/agent/commands/defaults.sh with command: docker cp               
         /tmp/tmp3nl3omt1                                                       
         4a09909273e9c75402b5c69d5c832cb6d0f6ee1846d08ad1d5dd7e47dd5c8eb8:/home/
         agent/commands/defaults.sh                                             
DEBUG    Setting agent as owner of copied files at                              
         /home/agent/commands/defaults.sh with command: docker exec -u root     
         4a09909273e9c75402b5c69d5c832cb6d0f6ee1846d08ad1d5dd7e47dd5c8eb8 chown 
         -R agent:mlgym /home/agent/commands/defaults.sh                        
DEBUG    Copying /tmp/tmputhyrkcn to container at /home/agent/commands/search.sh
         with command: docker cp /tmp/tmputhyrkcn                               
         4a09909273e9c75402b5c69d5c832cb6d0f6ee1846d08ad1d5dd7e47dd5c8eb8:/home/
         agent/commands/search.sh                                               
DEBUG    Setting agent as owner of copied files at                              
         /home/agent/commands/search.sh with command: docker exec -u root       
         4a09909273e9c75402b5c69d5c832cb6d0f6ee1846d08ad1d5dd7e47dd5c8eb8 chown 
         -R agent:mlgym /home/agent/commands/search.sh                          
DEBUG    Copying /tmp/tmpdmu20whr to container at                               
         /home/agent/commands/edit_linting.sh with command: docker cp           
         /tmp/tmpdmu20whr                                                       
         4a09909273e9c75402b5c69d5c832cb6d0f6ee1846d08ad1d5dd7e47dd5c8eb8:/home/
         agent/commands/edit_linting.sh                                         
DEBUG    Setting agent as owner of copied files at                              
         /home/agent/commands/edit_linting.sh with command: docker exec -u root 
         4a09909273e9c75402b5c69d5c832cb6d0f6ee1846d08ad1d5dd7e47dd5c8eb8 chown 
         -R agent:mlgym /home/agent/commands/edit_linting.sh                    
DEBUG    Copying /tmp/tmpbqc0nc6j to container at                               
         /home/agent/commands/validate.sh with command: docker cp               
         /tmp/tmpbqc0nc6j                                                       
         4a09909273e9c75402b5c69d5c832cb6d0f6ee1846d08ad1d5dd7e47dd5c8eb8:/home/
         agent/commands/validate.sh                                             
DEBUG    Setting agent as owner of copied files at                              
         /home/agent/commands/validate.sh with command: docker exec -u root     
         4a09909273e9c75402b5c69d5c832cb6d0f6ee1846d08ad1d5dd7e47dd5c8eb8 chown 
         -R agent:mlgym /home/agent/commands/validate.sh                        
DEBUG    Copying /tmp/tmplpahhuz5 to container at /home/agent/commands/submit.sh
         with command: docker cp /tmp/tmplpahhuz5                               
         4a09909273e9c75402b5c69d5c832cb6d0f6ee1846d08ad1d5dd7e47dd5c8eb8:/home/
         agent/commands/submit.sh                                               
DEBUG    Setting agent as owner of copied files at                              
         /home/agent/commands/submit.sh with command: docker exec -u root       
         4a09909273e9c75402b5c69d5c832cb6d0f6ee1846d08ad1d5dd7e47dd5c8eb8 chown 
         -R agent:mlgym /home/agent/commands/submit.sh                          
Container created. Baseline: 0.7655

============================================================
TREE SEARCH - Root Node
============================================================
    [root] step 0: cat << 'ENDOFFILE' > train_and_predict.py
import pandas as pd
import numpy as np
    [root] step 1: validate
    [root] validate score=[]
    [root] step 2: python train_and_predict.py
    [root] step 3: validate
    [root] validate score=[{'accuracy': 0.8373205741626795}]
  [root] validate → 0.8373

============================================================
TREE SEARCH - Depth 1 (1 nodes to expand)
============================================================

  Generating strategies for root (score=0.8373) [tail-sampling]...

  --- Branch root_0 (p=0.12) ---
  Strategy: Apply a gradient boosting ensemble (e.g., XGBoost or LightGBM) with cross-validation and hyperparame
    [root_0] step 0: cat << 'ENDOFFILE' > train_and_predict.py
import pandas as pd
import numpy as np
    [root_0] step 1: validate
    [root_0] validate score=[]
    [root_0] step 2: python train_and_predict.py
    [root_0] python ERROR: Traceback (most recent call last):
  File "/home/agent/workspace/train_and_predict.py", line 4, in <module>
    from xgboost import XGBClassifier
Modu
    [root_0] step 3: cat << 'ENDOFFILE' > train_and_predict.py
import pandas as pd
import numpy as np
    [root_0] step 4: python train_and_predict.py
    [root_0] step 5: validate
    [root_0] validate score=[{'accuracy': 0.861244019138756}]
  [root_0] validate → 0.8612

  --- Branch root_1 (p=0.14) ---
  Strategy: Perform deep learning with a multi-layer perceptron (MLP) using embeddings for categorical variables
    [root_1] step 0: cat << 'ENDOFFILE' > train_and_predict.py
import pandas as pd
import numpy as np
    [root_1] step 1: validate
    [root_1] validate score=[]
    [root_1] step 2: python train_and_predict.py
    [root_1] python ERROR: Traceback (most recent call last):
  File "/home/agent/workspace/train_and_predict.py", line 6, in <module>
    import tensorflow as tf
ModuleNotFound
    [root_1] step 3: pip install tensorflow
    [root_1] step 4: cat << 'ENDOFFILE' > train_and_predict.py
import pandas as pd
import numpy as np
    [root_1] step 5: python train_and_predict.py
    [root_1] python ERROR: Traceback (most recent call last):
  File "/home/agent/workspace/train_and_predict.py", line 6, in <module>
    import xgboost as xgb
ModuleNotFoundEr
    [root_1] step 6: pip install xgboost
    [root_1] step 7: python train_and_predict.py
    [root_1] step 8: validate
    [root_1] validate score=[{'accuracy': 0.8038277511961722}]
  [root_1] validate → 0.8038

  --- Branch root_2 (p=0.11) ---
  Strategy: Implement target encoding with smoothing for categorical variables (e.g., 'embarked', 'cabin', 'name
    [root_2] step 0: cat << 'ENDOFFILE' > train_and_predict.py
import pandas as pd
import numpy as np
    [root_2] validate score=[]
    [root_2] step 1: validate
    [root_2] validate score=[]
    [root_2] step 2: python train_and_predict.py
    [root_2] python ERROR: 1/site-packages/pandas/core/indexes/base.py", line 6252, in _raise_if_missing
    raise KeyError(f"{not_found} not in index")
KeyError: "['Embarked_ta
    [root_2] step 3: cat << 'ENDOFFILE' > train_and_predict.py
import pandas as pd
import numpy as np
    [root_2] validate score=[]
    [root_2] step 4: validate
    [root_2] validate score=[]
    [root_2] step 5: python train_and_predict.py
    [root_2] python ERROR: 1/site-packages/pandas/core/indexes/base.py", line 6252, in _raise_if_missing
    raise KeyError(f"{not_found} not in index")
KeyError: "['Embarked_ta
    [root_2] step 6: cat << 'ENDOFFILE' > train_and_predict.py
import pandas as pd
import numpy as np
    [root_2] validate score=[]
    [root_2] step 7: validate
    [root_2] validate score=[]
    [root_2] step 8: python train_and_predict.py
    [root_2] python ERROR: ne 535, in _check_feature_names
    raise ValueError(message)
ValueError: The feature names should match those that were passed during fit.
Feature na
    [root_2] step 9: cat << 'ENDOFFILE' > train_and_predict.py
import pandas as pd
import numpy as np
    [root_2] validate score=[]
    [root_2] step 10: validate
    [root_2] validate score=[]
    [root_2] step 11: python train_and_predict.py
    [root_2] python ERROR: ne 535, in _check_feature_names
    raise ValueError(message)
ValueError: The feature names should match those that were passed during fit.
Feature na
    [root_2] step 12: cat << 'ENDOFFILE' > train_and_predict.py
import pandas as pd
import numpy as np
    [root_2] validate score=[]
    [root_2] step 13: validate
    [root_2] validate score=[]
    [root_2] step 14: python train_and_predict.py
    [root_2] python ERROR: ne 535, in _check_feature_names
    raise ValueError(message)
ValueError: The feature names should match those that were passed during fit.
Feature na
  [root_2] Max actions reached, forcing validate

============================================================
TREE SEARCH - Depth 2 (3 nodes to expand)
============================================================

  Generating strategies for root_0 (score=0.8612) [tail-sampling]...

  --- Branch root_0_0 (p=0.12) ---
  Strategy: Apply a deep neural network (DNN) with a multi-layer perceptron (MLP) architecture to model non-line
    [root_0_0] step 0: cat << 'ENDOFFILE' > train_and_predict.py
import pandas as pd
import numpy as np
    [root_0_0] step 1: python train_and_predict.py
    [root_0_0] python ERROR: c/lib/python3.11/site-packages/tensorflow/python/framework/ops.py", line 33, in <module>
    from tensorflow.core.framework import attr_value_pb2
Modu
    [root_0_0] step 2: cat << 'ENDOFFILE' > train_and_predict.py
import pandas as pd
import numpy as np
    [root_0_0] step 3: python train_and_predict.py
    [root_0_0] python ERROR: ace/train_and_predict.py", line 74, in <module>
    scores = cross_val_score(model, X_scaled, y, cv=5, scoring='accuracy')
             ^^^^^^^^^^^^^^
    [root_0_0] step 4: cat << 'ENDOFFILE' > train_and_predict.py
import pandas as pd
import numpy as np
    [root_0_0] step 5: python train_and_predict.py
    [root_0_0] step 6: validate
    [root_0_0] validate score=[{'accuracy': 0.861244019138756}]
  [root_0_0] validate → 0.8612

  --- Branch root_0_1 (p=0.14) ---
  Strategy: Perform extensive feature engineering by creating interaction terms (e.g., age * fare, class * sex) 
    [root_0_1] step 0: cat << 'ENDOFFILE' > train_and_predict.py
import pandas as pd
import numpy as np
    [root_0_1] step 1: python train_and_predict.py
    [root_0_1] python ERROR: ckages/pandas/core/dtypes/astype.py", line 133, in _astype_nansafe
    return arr.astype(dtype, copy=True)
           ^^^^^^^^^^^^^^^^^^^^^^^^^^^^
Val
    [root_0_1] step 2: cat << 'ENDOFFILE' > train_and_predict.py
import pandas as pd
import numpy as np
    [root_0_1] step 3: python train_and_predict.py
    [root_0_1] python ERROR: ckages/pandas/core/dtypes/astype.py", line 133, in _astype_nansafe
    return arr.astype(dtype, copy=True)
           ^^^^^^^^^^^^^^^^^^^^^^^^^^^^
Val
    [root_0_1] step 4: cat << 'ENDOFFILE' > train_and_predict.py
import pandas as pd
import numpy as np
    [root_0_1] step 5: python train_and_predict.py
    [root_0_1] python ERROR: org/stable/modules/impute.html You can find a list of all estimators that handle NaN values at the following page: https://scikit-learn.org/stable/mod
    [root_0_1] step 6: cat << 'ENDOFFILE' > train_and_predict.py
import pandas as pd
import numpy as np
    [root_0_1] step 7: python train_and_predict.py
    [root_0_1] step 8: validate
    [root_0_1] validate score=[{'accuracy': 0.8181818181818182}]
  [root_0_1] validate → 0.8182

  --- Branch root_0_2 (p=0.11) ---
  Strategy: Utilize a random forest with bagging and bootstrap aggregating, but introduce permutation-based feat
    [root_0_2] step 0: cat << 'ENDOFFILE' > train_and_predict.py
import pandas as pd
import numpy as np
    [root_0_2] step 1: python train_and_predict.py
    [root_0_2] python ERROR: nce
ImportError: cannot import name 'permutation_importance' from 'sklearn.model_selection' (/home/agent/miniconda3/envs/mlgym_generic/lib/python3.11/
    [root_0_2] step 2: cat << 'ENDOFFILE' > train_and_predict.py
import pandas as pd
import numpy as np
    [root_0_2] step 3: python train_and_predict.py
    [root_0_2] python ERROR: Traceback (most recent call last):
  File "/home/agent/workspace/train_and_predict.py", line 5, in <module>
    from imblearn.over_sampling import SMO
    [root_0_2] step 4: cat << 'ENDOFFILE' > train_and_predict.py
import pandas as pd
import numpy as np
    [root_0_2] step 5: python train_and_predict.py
    [root_0_2] step 6: validate
    [root_0_2] validate score=[{'accuracy': 0.9090909090909091}]
  [root_0_2] validate → 0.9091

  Generating strategies for root_1 (score=0.8038) [tail-sampling]...

  --- Branch root_1_0 (p=0.12) ---
  Strategy: Replace the MLP with a Random Forest classifier and perform extensive feature engineering: derive ne
    [root_1_0] step 0: cat << 'ENDOFFILE' > train_and_predict.py
import pandas as pd
import numpy as np
    [root_1_0] step 1: python train_and_predict.py
    [root_1_0] python ERROR: es/pandas/core/dtypes/astype.py", line 133, in _astype_nansafe
    return arr.astype(dtype, copy=True)
           ^^^^^^^^^^^^^^^^^^^^^^^^^^^^
ValueEr
    [root_1_0] step 2: cat << 'ENDOFFILE' > train_and_predict.py
import pandas as pd
import numpy as np
    [root_1_0] step 3: python train_and_predict.py
    [root_1_0] python ERROR: es/pandas/core/dtypes/astype.py", line 133, in _astype_nansafe
    return arr.astype(dtype, copy=True)
           ^^^^^^^^^^^^^^^^^^^^^^^^^^^^
ValueEr
    [root_1_0] step 4: cat << 'ENDOFFILE' > train_and_predict.py
import pandas as pd
import numpy as np
    [root_1_0] step 5: python train_and_predict.py
    [root_1_0] python ERROR: es/pandas/core/dtypes/astype.py", line 133, in _astype_nansafe
    return arr.astype(dtype, copy=True)
           ^^^^^^^^^^^^^^^^^^^^^^^^^^^^
ValueEr
    [root_1_0] step 6: cat << 'ENDOFFILE' > train_and_predict.py
import pandas as pd
import numpy as np
    [root_1_0] step 7: python train_and_predict.py
    [root_1_0] python ERROR: es/pandas/core/dtypes/astype.py", line 133, in _astype_nansafe
    return arr.astype(dtype, copy=True)
           ^^^^^^^^^^^^^^^^^^^^^^^^^^^^
ValueEr
    [root_1_0] step 8: cat << 'ENDOFFILE' > train_and_predict.py
import pandas as pd
import numpy as np
    [root_1_0] step 9: python train_and_predict.py
    [root_1_0] python ERROR: es/pandas/core/dtypes/astype.py", line 133, in _astype_nansafe
    return arr.astype(dtype, copy=True)
           ^^^^^^^^^^^^^^^^^^^^^^^^^^^^
ValueEr
    [root_1_0] step 10: cat << 'ENDOFFILE' > train_and_predict.py
import pandas as pd
import numpy as np
    [root_1_0] step 11: python train_and_predict.py
    [root_1_0] python ERROR: es/pandas/core/dtypes/astype.py", line 133, in _astype_nansafe
    return arr.astype(dtype, copy=True)
           ^^^^^^^^^^^^^^^^^^^^^^^^^^^^
ValueEr
    [root_1_0] step 12: cat << 'ENDOFFILE' > train_and_predict.py
import pandas as pd
import numpy as np
    [root_1_0] step 13: python train_and_predict.py
    [root_1_0] python ERROR: andas/core/dtypes/astype.py", line 133, in _astype_nansafe
    return arr.astype(dtype, copy=True)
           ^^^^^^^^^^^^^^^^^^^^^^^^^^^^
ValueError:
    [root_1_0] step 14: cat << 'ENDOFFILE' > train_and_predict.py
import pandas as pd
import numpy as np
  [root_1_0] Max actions reached, forcing validate

  --- Branch root_1_1 (p=0.15) ---
  Strategy: Switch to a Gradient Boosting Machine (e.g., LightGBM or CatBoost) and incorporate target encoding f
    [root_1_1] step 0: cat << 'ENDOFFILE' > train_and_predict.py
import pandas as pd
import numpy as np
    [root_1_1] step 1: python train_and_predict.py
    [root_1_1] python ERROR: Traceback (most recent call last):
  File "/home/agent/workspace/train_and_predict.py", line 6, in <module>
    import lightgbm as lgb
ModuleNotFoundE
    [root_1_1] step 2: pip install lightgbm
    [root_1_1] step 3: python train_and_predict.py
    [root_1_1] python ERROR: ):
  File "/home/agent/workspace/train_and_predict.py", line 88, in <module>
    model = lgb.train(
            ^^^^^^^^^^
TypeError: train() got an u
    [root_1_1] step 4: cat << 'ENDOFFILE' > train_and_predict.py
import pandas as pd
import numpy as np
    [root_1_1] step 5: python train_and_predict.py
    [root_1_1] python ERROR: call last):
  File "/home/agent/workspace/train_and_predict.py", line 89, in <module>
    model = lgb.train(
            ^^^^^^^^^^
TypeError: train()
    [root_1_1] step 6: cat << 'ENDOFFILE' > train_and_predict.py
import pandas as pd
import numpy as np
    [root_1_1] step 7: python train_and_predict.py
    [root_1_1] python ERROR: call last):
  File "/home/agent/workspace/train_and_predict.py", line 89, in <module>
    model = lgb.train(
            ^^^^^^^^^^
TypeError: train()
    [root_1_1] step 8: cat << 'ENDOFFILE' > train_and_predict.py
import pandas as pd
import numpy as np
    [root_1_1] step 9: python train_and_predict.py
    [root_1_1] step 10: validate
    [root_1_1] validate score=[{'accuracy': 0.868421052631579}]
  [root_1_1] validate → 0.8684

  --- Branch root_1_2 (p=0.11) ---
  Strategy: Introduce a Transformer-based model for tabular data (e.g., TabTransformer) that treats each row as 
    [root_1_2] step 0: cat << 'ENDOFFILE' > train_and_predict.py
import pandas as pd
import numpy as np
    [root_1_2] step 1: python train_and_predict.py
    [root_1_2] step 2: validate
    [root_1_2] validate score=[{'accuracy': 0.8421052631578947}]
  [root_1_2] validate → 0.8421
  Skipping root_2 (no score)

======================================================================
TREE SEARCH RESULTS
======================================================================
Baseline: 0.7655 | Best: 0.9091 (node: root_0_2) | Improvement: +0.1435
Nodes explored: 10
======================================================================

└── root [0.8373] Initial solution
    ├── root_0 [0.8612] Apply a gradient boosting ensemble (e.g., XGBoost 
    │   ├── root_0_0 [0.8612] Apply a deep neural network (DNN) with a multi-lay
    │   ├── root_0_1 [0.8182] Perform extensive feature engineering by creating 
    │   └── root_0_2 [0.9091] Utilize a random forest with bagging and bootstrap *** BEST ***
    ├── root_1 [0.8038] Perform deep learning with a multi-layer perceptro
    │   ├── root_1_0 [FAIL] Replace the MLP with a Random Forest classifier an
    │   ├── root_1_1 [0.8684] Switch to a Gradient Boosting Machine (e.g., Light
    │   └── root_1_2 [0.8421] Introduce a Transformer-based model for tabular da
    └── root_2 [FAIL] Implement target encoding with smoothing for categ

Best path: root -> root_0 -> root_0_2
  root: [0.8373] Initial solution
  root_0: [0.8612] Apply a gradient boosting ensemble (e.g., XGBoost or LightGBM) with cross-valida
  root_0_2: [0.9091] Utilize a random forest with bagging and bootstrap aggregating, but introduce pe

Results saved to outputs/tree_search/exp2.1/run2/result.json
