Setting up logger for name='MLGym'
Setting up logger for name='env_utils'
============================================================
Experiment 2: Tree Search with VS (local-refinement)
============================================================
Model: Qwen/Qwen3-4B-Instruct-2507
Branching: 3, Depth: 2
Max actions/node: 15
Temperature: 0.9
Verbalized sampling: True (mode: local)

Creating MLGym container...
Setting up logger for name='MLGymEnv'
INFO     Found image aigym/mlgym-agent:latest with tags:                        
         ['aigym/mlgym-agent:latest'], created: 2024-11-04T13:33:17.818245514Z  
         for linux amd64.                                                       
DEBUG    Starting container with command: docker run -i --rm --network host     
         --gpus '"device=7"' --name aigym-mlgym-agent-latest-d_7-a9999314ec     
         aigym/mlgym-agent:latest /bin/bash -l                                  
Setting up logger for name='MLGymTask'
DEBUG    Copying data/titanic/data to container at /home/agent/workspace/data   
         with command: docker cp data/titanic/data                              
         9500c972c31a4dd53d2ff28588d3fce3e4fa3d27db7f8349fd9f2458f424da6a:/home/
         agent/workspace/data                                                   
DEBUG    Setting agent as owner of copied files at /home/agent/workspace/data   
         with command: docker exec -u root                                      
         9500c972c31a4dd53d2ff28588d3fce3e4fa3d27db7f8349fd9f2458f424da6a chown 
         -R agent:mlgym /home/agent/workspace/data                              
DEBUG    Copying data/titanic/evaluate.py to container at /home/agent/workspace/
         with command: docker cp data/titanic/evaluate.py                       
         9500c972c31a4dd53d2ff28588d3fce3e4fa3d27db7f8349fd9f2458f424da6a:/home/
         agent/workspace/                                                       
DEBUG    Setting agent as owner of copied files at /home/agent/workspace/ with  
         command: docker exec -u root                                           
         9500c972c31a4dd53d2ff28588d3fce3e4fa3d27db7f8349fd9f2458f424da6a chown 
         -R agent:mlgym /home/agent/workspace/                                  
DEBUG    Copying /tmp/tmpmejlkyio to container at                               
         /home/agent/commands/defaults.sh with command: docker cp               
         /tmp/tmpmejlkyio                                                       
         9500c972c31a4dd53d2ff28588d3fce3e4fa3d27db7f8349fd9f2458f424da6a:/home/
         agent/commands/defaults.sh                                             
DEBUG    Setting agent as owner of copied files at                              
         /home/agent/commands/defaults.sh with command: docker exec -u root     
         9500c972c31a4dd53d2ff28588d3fce3e4fa3d27db7f8349fd9f2458f424da6a chown 
         -R agent:mlgym /home/agent/commands/defaults.sh                        
DEBUG    Copying /tmp/tmp2ajdfqm2 to container at /home/agent/commands/search.sh
         with command: docker cp /tmp/tmp2ajdfqm2                               
         9500c972c31a4dd53d2ff28588d3fce3e4fa3d27db7f8349fd9f2458f424da6a:/home/
         agent/commands/search.sh                                               
DEBUG    Setting agent as owner of copied files at                              
         /home/agent/commands/search.sh with command: docker exec -u root       
         9500c972c31a4dd53d2ff28588d3fce3e4fa3d27db7f8349fd9f2458f424da6a chown 
         -R agent:mlgym /home/agent/commands/search.sh                          
DEBUG    Copying /tmp/tmpr92z57j5 to container at                               
         /home/agent/commands/edit_linting.sh with command: docker cp           
         /tmp/tmpr92z57j5                                                       
         9500c972c31a4dd53d2ff28588d3fce3e4fa3d27db7f8349fd9f2458f424da6a:/home/
         agent/commands/edit_linting.sh                                         
DEBUG    Setting agent as owner of copied files at                              
         /home/agent/commands/edit_linting.sh with command: docker exec -u root 
         9500c972c31a4dd53d2ff28588d3fce3e4fa3d27db7f8349fd9f2458f424da6a chown 
         -R agent:mlgym /home/agent/commands/edit_linting.sh                    
DEBUG    Copying /tmp/tmptwyj4k8_ to container at                               
         /home/agent/commands/validate.sh with command: docker cp               
         /tmp/tmptwyj4k8_                                                       
         9500c972c31a4dd53d2ff28588d3fce3e4fa3d27db7f8349fd9f2458f424da6a:/home/
         agent/commands/validate.sh                                             
DEBUG    Setting agent as owner of copied files at                              
         /home/agent/commands/validate.sh with command: docker exec -u root     
         9500c972c31a4dd53d2ff28588d3fce3e4fa3d27db7f8349fd9f2458f424da6a chown 
         -R agent:mlgym /home/agent/commands/validate.sh                        
DEBUG    Copying /tmp/tmpsjnzye4n to container at /home/agent/commands/submit.sh
         with command: docker cp /tmp/tmpsjnzye4n                               
         9500c972c31a4dd53d2ff28588d3fce3e4fa3d27db7f8349fd9f2458f424da6a:/home/
         agent/commands/submit.sh                                               
DEBUG    Setting agent as owner of copied files at                              
         /home/agent/commands/submit.sh with command: docker exec -u root       
         9500c972c31a4dd53d2ff28588d3fce3e4fa3d27db7f8349fd9f2458f424da6a chown 
         -R agent:mlgym /home/agent/commands/submit.sh                          
Container created. Baseline: 0.7655

============================================================
TREE SEARCH - Root Node
============================================================
    [root] step 0: cat << 'ENDOFFILE' > train_and_predict.py
import pandas as pd
from sklearn.ensem
    [root] step 1: validate
    [root] validate score=[]
    [root] step 2: python train_and_predict.py
    [root] python ERROR: s/core/generic.py", line 2153, in __array__
    arr = np.asarray(values, dtype=dtype)
          ^^^^^^^^^^^^^^^^^^^^^^^^^^^^^^^
ValueError: could not 
    [root] step 3: cat << 'ENDOFFILE' > train_and_predict.py
import pandas as pd
from sklearn.ensem
    [root] step 4: validate
    [root] validate score=[]
    [root] step 5: python train_and_predict.py
    [root] python ERROR: /site-packages/sklearn/impute/_base.py", line 348, in _validate_input
    raise new_ve from None
ValueError: Cannot use median strategy with non-numer
    [root] step 6: cat << 'ENDOFFILE' > train_and_predict.py
import pandas as pd
from sklearn.ensem
    [root] step 7: validate
    [root] validate score=[]
    [root] step 8: python train_and_predict.py
    [root] step 9: cat << 'ENDOFFILE' > train_and_predict.py
import pandas as pd
from sklearn.ensem
    [root] step 10: validate
    [root] validate score=[{'accuracy': 0.8133971291866029}]
  [root] validate → 0.8134

============================================================
TREE SEARCH - Depth 1 (1 nodes to expand)
============================================================

  Generating strategies for root (score=0.8134) [local-refinement]...

  --- Branch root_0 (p=0.85) ---
  Strategy: Adjust the hyperparameters of the ensemble model (e.g., Random Forest) using grid search with cross-
    [root_0] step 0: cat << 'ENDOFFILE' > train_and_predict.py
import pandas as pd
from sklearn.ensem
    [root_0] step 1: python train_and_predict.py
    [root_0] step 2: validate
    [root_0] validate score=[{'accuracy': 0.8708133971291866}]
  [root_0] validate → 0.8708

  --- Branch root_1 (p=0.80) ---
  Strategy: Apply feature engineering to create new features such as 'family_size' (sibsp + parch + 1), 'age_gro
    [root_1] step 0: cat << 'ENDOFFILE' > train_and_predict.py
import pandas as pd
from sklearn.ensem
    [root_1] step 1: python train_and_predict.py
    [root_1] python ERROR: e/agent/workspace/train_and_predict.py", line 16, in <module>
    X_test['FamilySize'] = X_test['SibSp'] + X_test['Parch'] + 1
                       
    [root_1] step 2: cat << 'ENDOFFILE' > train_and_predict.py
import pandas as pd
from sklearn.ensem
    [root_1] step 3: python train_and_predict.py
    [root_1] python ERROR: site-packages/pandas/core/arrays/categorical.py", line 1614, in _validate_scalar
    raise TypeError(
TypeError: Cannot setitem on a Categorical with 
    [root_1] step 4: cat << 'ENDOFFILE' > train_and_predict.py
import pandas as pd
from sklearn.ensem
    [root_1] step 5: python train_and_predict.py
    [root_1] python ERROR: site-packages/pandas/core/arrays/categorical.py", line 1614, in _validate_scalar
    raise TypeError(
TypeError: Cannot setitem on a Categorical with 
    [root_1] step 6: cat << 'ENDOFFILE' > train_and_predict.py
import pandas as pd
from sklearn.ensem
    [root_1] step 7: python train_and_predict.py
    [root_1] python ERROR: ^^^^^^^^^^^^^^^^^^^^
  File "/home/agent/miniconda3/envs/mlgym_generic/lib/python3.11/site-packages/pandas/core/indexes/base.py", line 3812, in get_lo
    [root_1] step 8: cat << 'ENDOFFILE' > train_and_predict.py
import pandas as pd
from sklearn.ensem
    [root_1] step 9: python train_and_predict.py
    [root_1] python ERROR: site-packages/pandas/core/arrays/categorical.py", line 1614, in _validate_scalar
    raise TypeError(
TypeError: Cannot setitem on a Categorical with 
    [root_1] step 10: cat << 'ENDOFFILE' > train_and_predict.py
import pandas as pd
from sklearn.ensem
    [root_1] step 11: python train_and_predict.py
    [root_1] step 12: validate
    [root_1] validate score=[{'accuracy': 0.8564593301435407}]
  [root_1] validate → 0.8565

  --- Branch root_2 (p=0.78) ---
  Strategy: Perform feature selection using recursive feature elimination (RFE) with a Random Forest estimator t
    [root_2] step 0: cat << 'ENDOFFILE' > train_and_predict.py
import pandas as pd
from sklearn.ensem
    [root_2] step 1: python train_and_predict.py
    [root_2] step 2: validate
    [root_2] validate score=[{'accuracy': 0.8181818181818182}]
  [root_2] validate → 0.8182

============================================================
TREE SEARCH - Depth 2 (3 nodes to expand)
============================================================

  Generating strategies for root_0 (score=0.8708) [local-refinement]...

  --- Branch root_0_0 (p=0.85) ---
  Strategy: Introduce early stopping during training to prevent overfitting by monitoring validation loss across
    [root_0_0] step 0: cat << 'ENDOFFILE' > train_and_predict.py
import pandas as pd
from sklearn.ensem
    [root_0_0] step 1: python train_and_predict.py
    [root_0_0] step 2: validate
    [root_0_0] validate score=[{'accuracy': 0.8708133971291866}]
  [root_0_0] validate → 0.8708

  --- Branch root_0_1 (p=0.82) ---
  Strategy: Apply feature selection using mutual information or variance thresholding before training the ensemb
    [root_0_1] step 0: cat << 'ENDOFFILE' > train_and_predict.py
import pandas as pd
from sklearn.ensem
    [root_0_1] step 1: python train_and_predict.py
    [root_0_1] python ERROR: vs/mlgym_generic/lib/python3.11/site-packages/pandas/core/internals/construction.py", line 690, in _extract_index
    raise ValueError(msg)
ValueError
    [root_0_1] step 2: cat << 'ENDOFFILE' > train_and_predict.py
import pandas as pd
from sklearn.ensem
    [root_0_1] step 3: python train_and_predict.py
    [root_0_1] python ERROR: vs/mlgym_generic/lib/python3.11/site-packages/pandas/core/internals/construction.py", line 690, in _extract_index
    raise ValueError(msg)
ValueError
    [root_0_1] step 4: cat << 'ENDOFFILE' > train_and_predict.py
import pandas as pd
from sklearn.ensem
    [root_0_1] step 5: python train_and_predict.py
    [root_0_1] python ERROR: lib/python3.11/site-packages/sklearn/utils/validation.py", line 457, in check_consistent_length
    raise ValueError(
ValueError: Found input variable
    [root_0_1] step 6: cat << 'ENDOFFILE' > train_and_predict.py
import pandas as pd
from sklearn.ensem
    [root_0_1] validate score=[]
    [root_0_1] step 7: python train_and_predict.py
    [root_0_1] python ERROR: lib/python3.11/site-packages/sklearn/utils/validation.py", line 457, in check_consistent_length
    raise ValueError(
ValueError: Found input variable
    [root_0_1] step 8: cat << 'ENDOFFILE' > train_and_predict.py
import pandas as pd
from sklearn.ensem
    [root_0_1] step 9: python train_and_predict.py
    [root_0_1] python ERROR: lib/python3.11/site-packages/sklearn/utils/validation.py", line 457, in check_consistent_length
    raise ValueError(
ValueError: Found input variable
    [root_0_1] step 10: cat << 'ENDOFFILE' > train_and_predict.py
import pandas as pd
from sklearn.ensem
    [root_0_1] step 11: python train_and_predict.py
    [root_0_1] python ERROR: lib/python3.11/site-packages/sklearn/utils/validation.py", line 457, in check_consistent_length
    raise ValueError(
ValueError: Found input variable
    [root_0_1] step 12: cat << 'ENDOFFILE' > train_and_predict.py
import pandas as pd
from sklearn.ensem
    [root_0_1] step 13: python train_and_predict.py
    [root_0_1] python ERROR: lib/python3.11/site-packages/sklearn/utils/validation.py", line 457, in check_consistent_length
    raise ValueError(
ValueError: Found input variable
    [root_0_1] step 14: cat << 'ENDOFFILE' > train_and_predict.py
import pandas as pd
from sklearn.ensem
  [root_0_1] Max actions reached, forcing validate

  --- Branch root_0_2 (p=0.80) ---
  Strategy: Expand the hyperparameter search space for max_depth to include [30, 40, 50] and introduce a minimum
    [root_0_2] step 0: cat << 'ENDOFFILE' > train_and_predict.py
import pandas as pd
from sklearn.ensem
    [root_0_2] step 1: python train_and_predict.py
    [root_0_2] step 2: validate
    [root_0_2] validate score=[{'accuracy': 0.8708133971291866}]
  [root_0_2] validate → 0.8708

  Generating strategies for root_1 (score=0.8565) [local-refinement]...

  --- Branch root_1_0 (p=0.85) ---
  Strategy: Introduce a more granular age grouping strategy by splitting age into 5 categories (e.g., 0–12, 13–1
    [root_1_0] step 0: cat << 'ENDOFFILE' > train_and_predict.py
import pandas as pd
from sklearn.ensem
    [root_1_0] step 1: python train_and_predict.py
    [root_1_0] step 2: validate
    [root_1_0] validate score=[{'accuracy': 0.8564593301435407}]
  [root_1_0] validate → 0.8565

  --- Branch root_1_1 (p=0.82) ---
  Strategy: Create a "class_and_age_interaction" feature by combining the passenger class (Pclass) with age bins
    [root_1_1] step 0: cat << 'ENDOFFILE' > train_and_predict.py
import pandas as pd
from sklearn.ensem
    [root_1_1] step 1: python train_and_predict.py
    [root_1_1] python ERROR: /mlgym_generic/lib/python3.11/site-packages/pandas/core/arrays/categorical.py", line 1694, in __array_ufunc__
    raise TypeError(
TypeError: Object w
    [root_1_1] step 2: cat << 'ENDOFFILE' > train_and_predict.py
import pandas as pd
from sklearn.ensem
    [root_1_1] step 3: python train_and_predict.py
    [root_1_1] python ERROR: ages/pandas/core/generic.py", line 2153, in __array__
    arr = np.asarray(values, dtype=dtype)
          ^^^^^^^^^^^^^^^^^^^^^^^^^^^^^^^
ValueError: 
    [root_1_1] step 4: cat << 'ENDOFFILE' > train_and_predict.py
import pandas as pd
from sklearn.ensem
    [root_1_1] step 5: python train_and_predict.py
    [root_1_1] python ERROR: ages/pandas/core/generic.py", line 2153, in __array__
    arr = np.asarray(values, dtype=dtype)
          ^^^^^^^^^^^^^^^^^^^^^^^^^^^^^^^
ValueError: 
    [root_1_1] step 6: cat << 'ENDOFFILE' > train_and_predict.py
import pandas as pd
from sklearn.ensem
    [root_1_1] step 7: python train_and_predict.py
    [root_1_1] step 8: validate
    [root_1_1] validate score=[{'accuracy': 0.8444976076555024}]
  [root_1_1] validate → 0.8445

  --- Branch root_1_2 (p=0.80) ---
  Strategy: Generate a "fare_per_person_smoothed" feature by applying a median or quartile-based smoothing of fa
    [root_1_2] step 0: cat << 'ENDOFFILE' > train_and_predict.py
import pandas as pd
from sklearn.ensem
    [root_1_2] step 1: python train_and_predict.py
    [root_1_2] step 2: validate
    [root_1_2] validate score=[{'accuracy': 0.861244019138756}]
  [root_1_2] validate → 0.8612

  Generating strategies for root_2 (score=0.8182) [local-refinement]...

  --- Branch root_2_0 (p=0.85) ---
  Strategy: Apply recursive feature elimination (RFE) with a Random Forest estimator, but use a higher number of
    [root_2_0] step 0: cat << 'ENDOFFILE' > train_and_predict.py
import pandas as pd
from sklearn.ensem
    [root_2_0] step 1: python train_and_predict.py
    [root_2_0] step 2: validate
    [root_2_0] validate score=[{'accuracy': 0.8325358851674641}]
  [root_2_0] validate → 0.8325

  --- Branch root_2_1 (p=0.80) ---
  Strategy: Instead of using default parameter values, tune the max_depth parameter of the Random Forest estimat
    [root_2_1] step 0: cat << 'ENDOFFILE' > train_and_predict.py
import pandas as pd
from sklearn.ensem
    [root_2_1] step 1: python train_and_predict.py
    [root_2_1] step 2: validate
    [root_2_1] validate score=[{'accuracy': 0.8899521531100478}]
  [root_2_1] validate → 0.8900

  --- Branch root_2_2 (p=0.82) ---
  Strategy: Use cross-validation (e.g., 5-fold) during the RFE process to evaluate feature subsets, rather than 
    [root_2_2] step 0: cat << 'ENDOFFILE' > train_and_predict.py
import pandas as pd
from sklearn.ensem
    [root_2_2] step 1: python train_and_predict.py
    [root_2_2] step 2: validate
    [root_2_2] validate score=[{'accuracy': 0.8181818181818182}]
  [root_2_2] validate → 0.8182

======================================================================
TREE SEARCH RESULTS
======================================================================
Baseline: 0.7655 | Best: 0.8900 (node: root_2_1) | Improvement: +0.1244
Nodes explored: 13
======================================================================

└── root [0.8134] Initial solution
    ├── root_0 [0.8708] Adjust the hyperparameters of the ensemble model (
    │   ├── root_0_0 [0.8708] Introduce early stopping during training to preven
    │   ├── root_0_1 [FAIL] Apply feature selection using mutual information o
    │   └── root_0_2 [0.8708] Expand the hyperparameter search space for max_dep
    ├── root_1 [0.8565] Apply feature engineering to create new features s
    │   ├── root_1_0 [0.8565] Introduce a more granular age grouping strategy by
    │   ├── root_1_1 [0.8445] Create a "class_and_age_interaction" feature by co
    │   └── root_1_2 [0.8612] Generate a "fare_per_person_smoothed" feature by a
    └── root_2 [0.8182] Perform feature selection using recursive feature 
        ├── root_2_0 [0.8325] Apply recursive feature elimination (RFE) with a R
        ├── root_2_1 [0.8900] Instead of using default parameter values, tune th *** BEST ***
        └── root_2_2 [0.8182] Use cross-validation (e.g., 5-fold) during the RFE

Best path: root -> root_2 -> root_2_1
  root: [0.8134] Initial solution
  root_2: [0.8182] Perform feature selection using recursive feature elimination (RFE) with a Rando
  root_2_1: [0.8900] Instead of using default parameter values, tune the max_depth parameter of the R

Results saved to outputs/tree_search/exp2.3/run5/result.json
